text,problem
"There's a distinct, salty flavor that I can't place.",salty
It has a mineral-like saltiness.,salty
"My espresso shot has a weird, salty tang.",salty
The coffee is leaving a salty film in my mouth.,salty
It's a very unusual and salty brew.,salty
This tastes like ocean water mixed with coffee.,salty
"There's a savory, brothy note that tastes like salt.",salty
My coffee has a persistent salty taste.,salty
"It's not bitter or sour, but it's unpleasantly salty.",salty
The coffee has a salty and chemical-like taste.,salty
I've never had coffee taste this salty before.,salty
"My coffee tastes hollow, like there's something missing.",hollow
"It has some flavor upfront, but the finish is empty.",hollow
The taste disappears almost immediately after I swallow.,hollow
It's a very shallow and unsatisfying cup.,hollow
The coffee feels empty and lacks depth.,hollow
It starts out promising but then just vanishes.,hollow
"There's no lingering aftertaste, it's just hollow.",hollow
The flavor profile feels incomplete.,hollow
"It's a bit sour and a bit bitter, but with nothing in the middle.",hollow
This cup lacks a core of sweetness or body.,hollow
It's a very thin and hollow-tasting coffee.,hollow
The flavor is one-dimensional and hollow.,hollow
It's like a ghost of a good coffee.,hollow
My pour-over tastes hollow and unfinished.,hollow
The coffee has a beginning but no middle or end.,hollow
It's a very unmemorable and hollow brew.,hollow
This coffee lacks complexity and tastes hollow.,hollow
The flavor is fleeting and leaves an empty feeling.,hollow
It's a very light-bodied and hollow cup.,hollow
The coffee tastes like it's been stripped of its character.,hollow
This light roast has a very strong grassy flavor.,grassy
"It tastes like freshly cut grass, and not in a good way.",grassy
"My coffee has a green, vegetal taste.",grassy
It tastes like under-ripe fruit and grass.,grassy
This coffee bean might be under-roasted; it tastes grassy.,grassy
There's a hay-like flavor in my cup.,grassy
"It has a very herbal, almost grassy, character.",grassy
My pour-over has a distracting grassy note.,grassy
The coffee tastes like green bell peppers.,grassy
It's a very raw and grassy-tasting brew.,grassy
"This coffee has a very pronounced, green taste.",grassy
The aftertaste is vegetal and grassy.,grassy
It tastes like I'm drinking a plant.,grassy
My home-roasted coffee tastes a bit grassy.,grassy
There's a strong note of green beans or peas.,grassy
It's a very light and grassy cup.,grassy
"The coffee has an unripe, grassy quality.",grassy
This tastes more like a green tea than a coffee.,grassy
It has a very fresh but unpleasantly grassy flavor.,grassy
The coffee lacks sweetness and has a strong grassy taste.,grassy
This has an intense acidic punch.,sour
My brew is wincingly sour.,sour
It's so acidic it tastes like it's not even coffee.,sour
The dominant note is a really unpleasant sourness.,sour
I must have brewed this too fast; it's incredibly sour.,sour
This espresso is a total sour bomb.,sour
My cup tastes tart and unfinished.,sour
It has a sourness that coats my entire mouth.,sour
"This is way too acidic, almost corrosive.",sour
The coffee is sour and lacks any sweetness to balance it.,sour
"It's leaving a really dry, bitter taste in my mouth.",bitter
The brew is so bitter it's making me grimace.,bitter
This tastes like straight-up baking soda.,bitter
"I can't drink this, the bitterness is off the charts.",bitter
My coffee has a chemical-like bitterness today.,bitter
"It's not just strong, it's unpleasantly bitter.",bitter
The bitterness completely masks any other flavor.,bitter
My espresso shot choked the machine and came out super bitter.,bitter
This is the most bitter cup of coffee I've ever had.,bitter
"It has a bitter, alkaline flavor.",bitter
"I can barely taste the coffee, it's so weak.",weak
This brew is just plain timid.,weak
"There's no substance to this cup, it's just weak.",weak
It's a ghost of a coffee.,weak
This is so unsatisfyingly weak.,weak
Did I use enough coffee? This tastes really weak.,weak
The coffee tastes insipid and watery.,weak
"I'm getting just a hint of coffee flavor, it's too weak.",weak
This tastes like coffee-flavored water.,weak
"The body is nonexistent, just weak.",weak
It tastes like charcoal.,burnt
"The beans smell burnt, and the coffee tastes the same.",burnt
"This has a burnt, tire-like flavor.",burnt
My coffee tastes like an ashtray smells.,burnt
"It's a very smoky, burnt-tasting cup.",burnt
The dominant flavor here is carbon.,burnt
This is over-roasted to the point of tasting burnt.,burnt
"It has a burnt, acrid flavor that's hard to get past.",burnt
I left the pot on the burner and now it tastes burnt.,burnt
This is just burnt and bad.,burnt
This tastes like it's been sitting in a warehouse for a year.,stale
"The coffee has a musty, stale flavor.",stale
"I'm getting nothing but stale, woody notes.",stale
These beans have definitely gone stale.,stale
It has that classic 'old coffee' taste.,stale
The flavor is completely flat and stale.,stale
"This is a very uninspired, stale cup.",stale
"It tastes like the air was sucked out of it, just stale.",stale
"No complexity, just a stale, singular note.",stale
It's stale and tastes like dust.,stale
I'm getting a lot of filter taste in this cup.,papery
This tastes like I'm chewing on cardboard.,papery
The papery taste is really distracting from the coffee.,papery
Did I use a bad filter? The coffee tastes papery.,papery
"It's a clean cup, but it's dominated by a papery flavor.",papery
"This has a dry, papery mouthfeel.",papery
I can taste the manufacturing process of the paper filter.,papery
"The coffee has a weird, pulpy, papery taste.",papery
It's like drinking coffee-infused paper.,papery
The main flavor note here is 'unbleached paper'.,papery
"This has a weird, tin-can taste.",metallic
My coffee tastes like it was brewed with old pennies.,metallic
There's a noticeable metallic twang in the aftertaste.,metallic
The finish is sharp and metallic.,metallic
"I can't tell if it's my water or my kettle, but this is metallic.",metallic
This coffee tastes like I have fillings in my teeth.,metallic
"It's got a very unnatural, metallic flavor.",metallic
This tastes like it was brewed in an aluminum can.,metallic
"The flavor is clean, but with a weird metallic note.",metallic
"It has a blood-like, metallic taste.",metallic
This is a very cloudy and muddy cup.,muddy
The texture is so gritty it's like drinking sand.,muddy
"All the flavors are blended into one indistinct, muddy taste.",muddy
"My coffee has a very unpleasant, earthy, muddy flavor.",muddy
It's a very heavy-bodied and muddy brew.,muddy
The cup is full of sludge and tastes muddy.,muddy
"This is a very low-clarity, muddy coffee.",muddy
It tastes like a mouthful of dirt.,muddy
"The flavors are not well-defined, just muddy.",muddy
It's a very thick and muddy coffee experience.,muddy
Why is my coffee salty?,salty
This tastes like it has a pinch of salt in it.,salty
"It's a savory, salty brew, and I don't like it.",salty
"The aftertaste has a strange, salty quality.",salty
"This is undrinkable, it's so salty.",salty
My coffee tastes like it was made with sea water.,salty
"It has a bizarre, salty twang.",salty
"I'm getting a weird, almost meaty, salty flavor.",salty
The dominant flavor is surprisingly salty.,salty
"This is a very weird, salty cup of coffee.",salty
The flavor is there one second and gone the next.,hollow
"This cup has no middle, just a beginning and an empty end.",hollow
It's a very superficial coffee flavor.,hollow
"I taste something, but it's not satisfying, it's hollow.",hollow
The structure of this coffee's flavor is hollow.,hollow
It's like there's a hole in the middle of the flavor.,hollow
This coffee is all aroma and no substance.,hollow
The taste is incredibly fleeting.,hollow
It's hollow and lacks any kind of satisfying finish.,hollow
This is a very forgettable and hollow cup.,hollow
It tastes like I'm chewing on a leaf.,grassy
"This coffee has a very green, uncooked flavor.",grassy
"I'm getting a strong vegetal, almost grassy taste.",grassy
"It's not fruity, it's just green and grassy.",grassy
This light roast tastes underdeveloped and grassy.,grassy
The coffee has a flavor like raw vegetables.,grassy
"It's a very earthy, grassy cup.",grassy
The main flavor note is just 'green'.,grassy
"This has a very sharp, grassy bite.",grassy
It tastes like it wasn't roasted long enough.,grassy
"My coffee makes my mouth pucker, kind of like drinking straight lemon juice.",sour
